{
  "schemaVersion": 1,
  "topic": {
    "id": "topic-a9e7f9714a1cba3d7b8c",
    "source": {
      "path": "engenharia-de-dados/01-modelagem-de-dados.md",
      "sha256": "7ce8d788e7452942fff9a89a10851901c0d8245f1f0844ad97f40f1a5317ae28",
      "rawSha256": "e4f40e63159ad026b11137d99129fdba0b0c14f3a6163669e0fcfa328a5876b1"
    }
  },
  "reviewedAt": "2026-10-07",
  "coverage": {
    "completeTopicReview": false,
    "scope": "Amostra seletiva de claims de ED01; não revisão integral dos 24 tópicos."
  },
  "sourceHierarchy": [
    "official-doc",
    "spec",
    "original-paper",
    "vendor",
    "canonical-book",
    "secondary"
  ],
  "claims": [
    {
      "id": "grain",
      "text": "**Grão (grain)** é o conceito mais importante e o mais negligenciado. O grão é a definição precisa do que representa **uma linha** da tabela fato. \"Uma linha por item de pedido\" é diferente de \"uma linha por pedido\", e escolher errado quebra tudo depois. Declarar o grão é a primeira coisa que se faz ao modelar — antes de escolher dimensões, antes de escolher métricas. Numa entrevista, se o entrevistador pede para modelar algo e você começa dizendo \"primeiro eu defino o grão da fato como...\", você já se diferenciou.",
      "status": "VERIFIED",
      "justification": "A precedência de declarar o grão antes de dimensões e fatos é sustentada, no contexto da orientação de modelagem.",
      "source": {
        "path": "engenharia-de-dados/01-modelagem-de-dados.md",
        "sha256": "7ce8d788e7452942fff9a89a10851901c0d8245f1f0844ad97f40f1a5317ae28",
        "span": {
          "start": 6875,
          "end": 6990,
          "startLine": 73,
          "endLine": 73
        },
        "contextSpan": {
          "start": 6620,
          "end": 7140,
          "startLine": 73,
          "endLine": 73
        },
        "sectionId": "sec-6d7f74d938cf767c5738",
        "anchor": "anchor-6d7f74d938cf767c5738",
        "rawSha256": "e4f40e63159ad026b11137d99129fdba0b0c14f3a6163669e0fcfa328a5876b1"
      },
      "externalSources": [
        {
          "type": "canonical-book",
          "url": "https://www.kimballgroup.com/data-warehouse-business-intelligence-resources/kimball-techniques/dimensional-modeling-techniques/grain/",
          "title": "Grain",
          "checkedAt": "2026-10-07",
          "locator": "Grain declaration"
        }
      ],
      "evidence": {
        "excerpt": "The grain must be declared before choosing dimensions or facts",
        "excerptKind": "paraphrase",
        "locator": "Grain declaration"
      },
      "review": {
        "checkedAt": "2026-10-07",
        "method": "Confronto da assertion delimitada com a fonte externa; excerpt identificado como paráfrase quando não citação literal.",
        "responsibility": "Pesquisa — 2026-10-07"
      },
      "proposedChanges": [],
      "assertion": "Declarar o grão é a primeira coisa que se faz ao modelar — antes de escolher dimensões, antes de escolher métricas.",
      "verifiedScope": "Declarar o grão é a primeira coisa que se faz ao modelar — antes de escolher dimensões, antes de escolher métricas.",
      "context": "**Grão (grain)** é o conceito mais importante e o mais negligenciado. O grão é a definição precisa do que representa **uma linha** da tabela fato. \"Uma linha por item de pedido\" é diferente de \"uma linha por pedido\", e escolher errado quebra tudo depois. Declarar o grão é a primeira coisa que se faz ao modelar — antes de escolher dimensões, antes de escolher métricas. Numa entrevista, se o entrevistador pede para modelar algo e você começa dizendo \"primeiro eu defino o grão da fato como...\", você já se diferenciou.",
      "statement": "Declarar o grão antes de escolher dimensões e métricas."
    },
    {
      "id": "semi-additive",
      "text": "- **Semi-aditiva**: pode somar em algumas dimensões, mas não em tempo (`saldo_conta` — somar saldos de contas diferentes no mesmo dia faz sentido; somar o saldo da mesma conta em dias diferentes não).",
      "status": "VERIFIED",
      "justification": "A fonte sustenta aditividade em algumas dimensões, mas não em todas; não se usa isso para verificar o exemplo específico de saldo.",
      "source": {
        "path": "engenharia-de-dados/01-modelagem-de-dados.md",
        "sha256": "7ce8d788e7452942fff9a89a10851901c0d8245f1f0844ad97f40f1a5317ae28",
        "span": {
          "start": 8166,
          "end": 8215,
          "startLine": 83,
          "endLine": 83
        },
        "contextSpan": {
          "start": 8146,
          "end": 8346,
          "startLine": 83,
          "endLine": 83
        },
        "sectionId": "sec-6d7f74d938cf767c5738",
        "anchor": "anchor-6d7f74d938cf767c5738",
        "rawSha256": "e4f40e63159ad026b11137d99129fdba0b0c14f3a6163669e0fcfa328a5876b1"
      },
      "externalSources": [
        {
          "type": "canonical-book",
          "url": "https://www.kimballgroup.com/data-warehouse-business-intelligence-resources/kimball-techniques/dimensional-modeling-techniques/additive-semi-additive-non-additive-fact/",
          "title": "Additive, Semi-Additive, and Non-Additive Facts",
          "checkedAt": "2026-10-07",
          "locator": "Semi-additive facts"
        }
      ],
      "evidence": {
        "excerpt": "Measures can be additive across some dimensions but not all.",
        "excerptKind": "paraphrase",
        "locator": "Semi-additive facts"
      },
      "review": {
        "checkedAt": "2026-10-07",
        "method": "Confronto da assertion delimitada com a fonte externa; excerpt identificado como paráfrase quando não citação literal.",
        "responsibility": "Pesquisa — 2026-10-07"
      },
      "proposedChanges": [],
      "assertion": "pode somar em algumas dimensões, mas não em tempo",
      "verifiedScope": "pode somar em algumas dimensões",
      "context": "- **Semi-aditiva**: pode somar em algumas dimensões, mas não em tempo (`saldo_conta` — somar saldos de contas diferentes no mesmo dia faz sentido; somar o saldo da mesma conta em dias diferentes não).",
      "statement": "Medidas semi-aditivas podem somar em algumas dimensões."
    },
    {
      "id": "ratio-additivity",
      "text": "- **Não-aditiva**: não pode somar em nenhuma dimensão (percentuais, taxas, ratios). A regra prática é armazenar numerador e denominador separadamente como métricas aditivas e calcular o ratio na consulta — nunca armazenar a média pré-calculada, porque média de médias está errada quando os grupos têm tamanhos diferentes.",
      "status": "VERIFIED",
      "justification": "Ratios são não aditivos; componentes aditivos podem ser somados antes do cálculo final. A frase ampla sobre qualquer média pré-calculada não foi incluída como claim verificado.",
      "source": {
        "path": "engenharia-de-dados/01-modelagem-de-dados.md",
        "sha256": "7ce8d788e7452942fff9a89a10851901c0d8245f1f0844ad97f40f1a5317ae28",
        "span": {
          "start": 8366,
          "end": 8430,
          "startLine": 84,
          "endLine": 84
        },
        "contextSpan": {
          "start": 8347,
          "end": 8668,
          "startLine": 84,
          "endLine": 84
        },
        "sectionId": "sec-6d7f74d938cf767c5738",
        "anchor": "anchor-6d7f74d938cf767c5738",
        "rawSha256": "e4f40e63159ad026b11137d99129fdba0b0c14f3a6163669e0fcfa328a5876b1"
      },
      "externalSources": [
        {
          "type": "canonical-book",
          "url": "https://www.kimballgroup.com/data-warehouse-business-intelligence-resources/kimball-techniques/dimensional-modeling-techniques/additive-semi-additive-non-additive-fact/",
          "title": "Additive, Semi-Additive, and Non-Additive Facts",
          "checkedAt": "2026-10-07",
          "locator": "Non-additive facts"
        }
      ],
      "evidence": {
        "excerpt": "Ratios are non-additive; add the components before calculating the final ratio.",
        "excerptKind": "paraphrase",
        "locator": "Non-additive facts"
      },
      "review": {
        "checkedAt": "2026-10-07",
        "method": "Confronto da assertion delimitada com a fonte externa; excerpt identificado como paráfrase quando não citação literal.",
        "responsibility": "Pesquisa — 2026-10-07"
      },
      "proposedChanges": [],
      "assertion": "não pode somar em nenhuma dimensão (percentuais, taxas, ratios).",
      "verifiedScope": "ratios",
      "context": "- **Não-aditiva**: não pode somar em nenhuma dimensão (percentuais, taxas, ratios). A regra prática é armazenar numerador e denominador separadamente como métricas aditivas e calcular o ratio na consulta — nunca armazenar a média pré-calculada, porque média de médias está errada quando os grupos têm tamanhos diferentes.",
      "statement": "Ratios não são aditivos."
    },
    {
      "id": "type-1",
      "text": "**Tipo 1 — Overwrite.** Sobrescreve o valor antigo. Sem histórico. Simples e barato.",
      "status": "VERIFIED",
      "justification": "Type 1 sobrescreve o valor anterior e destrói o histórico, segundo a fonte consultada.",
      "source": {
        "path": "engenharia-de-dados/01-modelagem-de-dados.md",
        "sha256": "7ce8d788e7452942fff9a89a10851901c0d8245f1f0844ad97f40f1a5317ae28",
        "span": {
          "start": 12878,
          "end": 12920,
          "startLine": 133,
          "endLine": 133
        },
        "contextSpan": {
          "start": 12854,
          "end": 12938,
          "startLine": 133,
          "endLine": 133
        },
        "sectionId": "sec-6d7f74d938cf767c5738",
        "anchor": "anchor-6d7f74d938cf767c5738",
        "rawSha256": "e4f40e63159ad026b11137d99129fdba0b0c14f3a6163669e0fcfa328a5876b1"
      },
      "externalSources": [
        {
          "type": "canonical-book",
          "url": "https://www.kimballgroup.com/data-warehouse-business-intelligence-resources/kimball-techniques/dimensional-modeling-techniques/type-1/",
          "title": "Type 1",